,index,0,bb,bt,tt
594,360,"we work as one team, and are a top 100 employer.",0,0,0
595,1973,the role holder will be writing code for the application of advanced analytics in the area financial crime risk and must be able to critically interpret and analyse the results produced.,0,1,1
596,124,"as senior data manager, you'll manage the prioritisation and implementation of data-related deliverables and align them with the overall business strategy and operating models.",0,2,0
597,815,scheduled weekly hours:40full timelandmark information group is a portfolio of leading property-related data and spatial technology businesses at the forefront of innovation and thought leadership.,0,0,0
598,2766,"they will also develop complex information reporting tools, presenting detailed analysis of activity & performance trends, providing expert analytical and statistical advice to clinicians, operational staff, the mohhi programme team and trust executive and board.",0,1,1
599,436,keen to learn and gain exposure to all aspects of the (re)insurance market.,0,0,0
600,1899,"the project will be built with sustainable mining as a clear focus, using a low-energy, non-chemical production process and investing in metal and mineral of exceptional quality to ensure that it has a minimal impact on the environment.",0,0,0
601,1892,"6-problem solving

3-understands problems by identifying multiple links (e.g.",0,0,0
602,1963,wellness.,0,0,0
603,639,"ensuring own work, and work of team, is compliant with good laboratory practice, safety, health and environment standards and all other internal astrazeneca standards and external regulations as they apply.",0,0,0
604,2449,the particular challenges of our domain require applying a wide range of classical to cutting-edge techniques – often with extensive tailoring – to build models and statistically validate their predicted performance.,0,0,1
605,149,"you will be building a system that can understand customers and automatically recommend destinations, experiences and products to give users the holiday of their dreams 3 times a year.",0,2,0
606,2775,"for further details / informal visits contact

diane maunder

head of business intelligence

01256 852629playdemic, a division of wb games inc., are looking for a talented data scientist with a passion for mobile games and cutting edge analytics, to join our fast-paced studio.",0,0,0
607,1134,"salary: £27,000 to £36,000 per annum.",0,0,0
608,220,we’re all about pushing the boundaries and being innovative.,0,0,0
609,535,"by using the latest scientific techniques, we produce world-beating predictive research and build advanced technology to analyse the world's data.",0,0,1
610,500,a desire to learn about violent extremism and different methods for countering it.,0,0,0
611,651,detailed knowledge of core computer science concepts (e.g.,0,0,0
612,1955,"experience in data mining and using databases in a business environment with large-scale, complex datasets.",0,1,0
613,1410,"at the interview we will be assessing your technical/specialist experience, outlined in the above role description, testing your ability through relevant assessments and asking you questions to assess behaviours and strengths.",0,0,0
614,2075,"we really don't have much in the way of red tape, so expect to start making a positive impact on our games, right from the get-go.",0,0,0
615,2042,"gocd, gitlab).",0,0,0
616,1552,we all take pride in a job well done and share the belief that an inclusive culture is key to our success and vision for the future.,0,0,0
617,1998,"experience working within the hadoop ecosystem in addition to strong technical skills in analytical languages such as python, r, sql, sas.",0,0,0
618,1613,"there are opportunities in the role to be more involved with database software such as access and sql, although we are not seeking a database administrator per se.",0,0,0
619,1462,"working alongside our analytics, consulting and reporting specialists within the team, the data analyst plays a critical role in our evolving eco-system.",0,0,0
620,17,"requirements
·bs/ms/phd in computer science, mathematics, physics, or related field.",0,0,0
621,1035,"the data science team are part of the delivery consulting team, delivering a data science consulting offering across a wide portfolio of clients and services.",0,1,0
622,1694,"assignments may differ for individuals within the same role based on business conditions, departmental need or geographic location.",0,0,0
623,2893,this is an excellent opportunity to join a progressive company and help shape their growing team of data scientists.,0,0,0
624,122,we're a changing business with big ambitions.,0,0,0
625,1472,please click here to find out more about our key information documents.,0,0,0
626,418,we are striving to create a world in which decisions that can improve the lives of vulnerable people are based on the most appropriate evidence.,0,0,0
627,1753,creating self-serve dashboards with a view to providing users with timely and accurate data that is valuable for sales enablement and product and inventory insight.,0,1,0
628,685,"if you have any queries about this position, please feel free to drop her an e-mail.",0,0,0
629,2834,communicate effectively across a variety of technical and non-technical audiences.,0,0,0
630,1268,life assurance – you would immediately be entitled to be part of bossa’s life assurance scheme which in the unfortunate event of an employee’s death their subsidiaries will receive a tax free lump sum payment of 4 times their annual salary.,0,0,0
631,1641,experience setting-up and maintaining tableau or looker (preferable) reporting.,0,0,0
632,2925,"experience with deep learning / machine learning libraries such as tensorflow, torch, theano, caffe, scikit-learn, deeplearning4j etc.",0,0,0
633,2225,the nature of our team is collaborative with an emphasis on genuine passion for healthcare.,0,0,0
634,3027,"we have a strong commitment to your learning, development and well-being, with hundreds of different courses available - ranging from bite-sized e-learning courses, to on-site workshops and professional certifications.",0,0,0
635,2309,the data scientist is responsible for leveraging these datasets to provide data-driven solutions and guidance to the wider business.,0,1,0
636,2337,someone who doesn’t just dream it but gets it done.,0,0,0
637,1157,proficiency in using one or more statistical software packages (e.g.,0,0,0
638,812,"undertaking data capture from numerous systems, including conducting data audits and sanitisations as required.",0,0,1
639,2600,"data scientist – london – £45,000 – £65,000 plus benefits

a leading social gaming company are looking to expand their data science team due to growing demand in data science services, and are therefore seeking an experienced data scientist.",0,0,0
640,1516,an open culture that encourages sharing of ideas.,0,0,0
641,1341,"this includes churn life cycles, ltv, product engagement, retention curves, surveys, reviews, feedback and market research
leveraging your highly proactive nature, you will identity data gaps and resolve this by taking a lead in ensuring that all tagging is accurately and fully delivered
analyse website and app journeys to understand customer behaviour and to deliver insight and improvement recommendations to cover customer journeys, campaigns, cross-sell activity and customer satisfaction
you will play a key role in driving our optimisation programme forward through idea conception, analysis and actionable recommendations


requirements
proven experience in a data analysis role in fast growing businesses
highly proficient in mysql to deliver insight from our database quickly and accurately to our key teams
excellent understanding of google analytics and other web analytics solutions
data-driven storytelling and visualisation skills (with tools like tableau, powerbi, indicative etc)
attention to detail coupled with excellent problem-solving skills
experience working with, and presenting to non-technical stakeholders
experience creating and delivering projects from scratch
outstanding excel skills

attributes
you are analytical, inquisitive and have a huge thirst for data
you have at least 2 years’ hands-on experience of google analytics
your background is not just reporting – you are experienced in working with and/or developing advanced customer analytics methodologies, utilising all data at your disposal for a complete customer first view
you also have a good overall understanding of the technical applications you use, and how to improve them in the future to make them even more valuable to the business
you are of course naturally numerate and advanced in excel – and therefore you probably have a degree in maths, management science or business, or in a similar field
if you have experience with using a tag management solution that is desirable, but not mandatory


benefits
a competitive salary
be part of a rapidly growing business with international expansion plans
above market equity/options
flexible work schedule and location
team cooking and tasting days
free simplycook subscription
fully covered week-long team working holiday every yearthis position will be working in partnership with the university of edinburgh.",0,0,0
642,2702,it is ingrained in their culture that you have to be constantly challenged and stimulated.,0,0,0
643,2183,product madness’ dedication to promoting diversity and inclusion is clearly reflected in all our content and across all our platforms.,0,0,0
644,2641,coding experience with python.,0,0,0
645,872,this is the best place to submit your application for it to be reviewed by our team.,0,0,0
646,960,"whatever we do, wherever we are in the world, we lead the way, serve with integrity, take care of each other, foster inclusion, and collaborate for maximum impact.",0,0,0
647,2661,celonis is one of the world's fastest growing technology companies and the global market leader in process mining software backed up by our investors accel and 83north.,0,0,0
648,1989,also by addressing any areas of concern in conjunction with line management and/or the appropriate department.,0,0,0
649,1692,"in addition to providing career advancement opportunities and a collaborative work environment, vonage provides great pay and benefits, including unlimited discretionary time off.",0,0,0
650,1566,"in return we can:

offer continuous development options with access to training courses and certifications
pay you a salary in-line/ slightly above market rate (happy to disclose at first stage)
offer a 10.5% pension contribution
allow flexible working times with early/late finishes and compressed hours if of interest

this is a great role for a data scientist looking to take the next step in their career and continue to learn.",0,0,0
651,742,"ict competency

ms office excel

ms office word

experience with bi tools

sql skills would be advantageous but not essential

experience using large data sets would also be advantageous

this role is based just outside of peterborough and stamford and is commutable from orton, hampton, werrington, grantham, corby, market deeping, wittering.job description

principle data scientist - london - £110,000 + benefits + bonus

i am working exclusively with one of my key clients to find an experience principle data scientist in london.",0,0,0
652,1599,"we strive for fresh perspectives, so as long as you can demonstrate how your attitude and other abilities might make up for any gaps we would welcome your application!",0,0,0
653,153,sql/nosql databases and cloud experience.,0,0,0
654,1816,"this is not an exclusive list.as part of the company's growth, they are currently seeking a data scientist at mid to senior level

roles and responsibilities

you will work as part of a dedicated data science and machine learning team overseeing various projects covering technology, marketing and prediction platforms.",0,2,0
655,1852,"you'll have our full support, training and opportunities for professional development, along with a contributory pension, life assurance and good holiday entitlement.about us 

the athletic is a subscription-based media publisher of smarter sports coverage for die-hard fans.",0,0,0
656,962,"being a leader at deloitte

cultural fit and purpose-led leadership is crucial for deloitte.",0,0,0
657,1738,"take direction and priority for daily actions/activities from the existing team of consultants
skills
educated to a-level mathematics (minimum)
extremely numerate
strong communication skills both written and oral
comfortable using excel to an advanced level
methodical and organised with a very good attention to detail
able to think creatively and see the bigger picture
enthusiastic and a team player
good at problem-solving and troubleshooting
has an ability to learn new systems quickly
can work autonomously under own initiative.description

position overview: the individual will be responsible for working directly with our internal and external clients (primarily law firms and corporate legal departments) and project managers.",0,0,0
658,1867,with that in mind they are looking to build out their data science function further and take advantage of the masses of data they've collected to be able to personalise and optimise their customer journey.,0,2,0
659,798,experience and knowledge of statistical modelling.,0,0,0
660,509,build robust data pipelines.,0,0,0
661,590,"here's a taste of what you will be doing:

run pricing and support decisions around tariff options.",0,1,0
662,1996,"knowledge & experience / qualifications
a combination of applied mathematics, statistics, advanced computing (machine learning, artificial intelligence), visualisation, data engineering.",0,0,0
663,1465,"as a growing, dynamic, and fast-paced company this role will suit someone who is looking to make an impact, and develop and shape a data analytics proposition.",0,0,0
664,2865,"– demonstrable knowledge of a range of statistical techniques eg, bayesian statistics, probabilistic programming and graphical models
– strong knowledge of a variety of machine learning methods
– strong coding skills, proficient in r or python
– previous experience working with complex biological or ‘omic’s datasets, eg.",0,0,1
665,2107,"as a result, we’re looking for the most talented, passionate and dedicated individuals to join us.",0,0,0
666,84,please note that in the event that the required clearance cannot be obtained you may not be eligible for the role and/or any offer of employment may be withdrawn on grounds of national security.,0,0,0
667,2101,"personal attributes 

intelligent
creative - you are able to use your creativity to identify new opportunities and find creative solutions to problems
hard-working
organised
reliable
personable 


about playdemic 

founded in 2010 by leading games industry entrepreneurs, playdemic is a bafta award winning developer and publisher of mobile games, focused on creating fun and engaging, free-to-play game services for ios and android.",0,0,0
668,2731,"responsibilities
help us expand our existing reporting and dashboard solutions.",0,0,0
669,1251,"benefits

ocado employee experience is very important to us.",0,0,0
670,1356,lead on projects across multiple departments.,0,0,0
671,2390,experience with machine learning techniques and data science projects.,0,0,0
672,1454,"working alongside our analytics, consulting and reporting specialists within the team, the data analyst plays a critical role in our evolving eco-system.",0,1,0
673,2232,"(must have) experience with causal discovery (e.g., by building directed graphical causal models) or causal inference (e.g., mendelian randomization, instrumental variable analysis, structural equation modelling)
solid programming experience in one or more scientific programming language r, python, c/c++, etc.",0,0,0
674,2171,"communication able to talk, write, and listen effectively with business peers as well as junior data scientists.",0,0,0
675,2420,"responsibilities include (but aren't limited to)
solve difficult problems
use mathematics
write code
work with lots of data 

essential criteria
must be an eu citizen or possess a current uk tier 1 visa or tier 2 visa and eligible to take up full time, permanent employment.",0,0,0
676,1200,"requirements

minimum academic qualifications
2.1 degree in a stem subject from a top tier university.",0,0,0
677,956,what brings us all together at deloitte?,0,0,0
678,2908,"essential skills
masters or phd in relevant studies e.g.",0,0,0
679,2905,"you will be involved in the data-mining, machine learning and graph analysis techniques for a variety of modelling problems involving customers, their relationships and their fashion preferences, as well as building scalable statistical models that learn from large volumes of data and produce real-world value.",0,2,0
680,1846,"the candidate
with extensive experience of data analytics and reporting you will have advanced knowledge of powerbi/tableu as well as experience with cloud data platforms such as google bigquery.",0,0,1
681,690,"they are looking for a creative and experienced machine learning data scientist with commercial experience of building ml models and implementing them (target language is python, or possibly r, but happy to cross train from java, c++, c# etc) into sophisticated applications.",0,0,2
682,1967,"a team that gets things done, and has fun doing it.role purpose
working as part of a team, the role holder will, using advanced analytical skills, develop the hsbc group’s new financial intelligence platform, through which it intends to pro-actively search for financial crime risks not detected by the group’s current suite of financial crime systems.",0,1,1
683,2877,we are creating a centralised team of data analysts who will be working with all teams across the company.,0,0,0
684,1746,the focus of this role will be to support the global business intelligence and advertising operations teams in their efforts to create a more data-driven business.,1,1,0
685,2130,visit www.nate.tech to learn more about what we do.,0,0,0
686,479,"using shiny)

knowledge of sequence-to-sequence models, or the use of rnns/lstms

knowledge of deep neural networks – tensorflow, keras, pytorch

knowledge of apis, git

blue legal offers the services of an employment agency for permanent work and an employment business for temporary work.job description
our client is at the heart of powering organisations with their enhanced artificial intelligence, as they enter into a new dimension of client development they are looking for the next generation of ai data-engineering researchers analytically focused.",0,0,0
687,2545,"sociology, psychology)
results orientated, ability to manage deadlines and time effectively
ability to find creative and innovative solutions for complex and varied problems
high level knowledge of data wrangling/manipulation techniques in r or python
good experience in working with database systems and sql syntax
experience with machine learning and predictive models in r or pandas (one is a must)
experience with running segmentations of respondent or customer data is a plus
outstanding attention to detail
good communication skills, oral, written and technical documentation

﻿if this is what you are looking for from your next role, we look forward to hearing from you!",0,0,0
688,399,"responsibilities
·review academic and industry literature for applicable knowledge.",0,0,0
689,2782,"design multi-variant tests to prove, tune and measure your hypotheses.",0,1,0
690,336,"based on cambridge science park, this company know exactly how to look after their staff.",0,0,0
691,2752,it has become the industry standard in the financial sector and is increasingly being used in a wide range of industries.,0,0,0
692,2188,"what makes us stand out from the crowd is the autonomy we provide our employees, the opportunity to work on top grossing titles and the professional development opportunities that everyone has access to.",0,0,0
693,1226,"what we are looking for:

masters degree or phd in a relevant technical or mathematical field
exceptional analytical, quantitative, problem-solving, and critical thinking skills
strong data management skills including sql
experience with data science and statistical analysis in python
strong written & verbal communication skills; including the ability to present detailed analyses to a broad audience range
ability to work collaboratively with other business units in order to achieve common objectives
organised self-starter, with drive and commitment; able to work with little supervision.",0,0,0
694,830,"you will enjoy working with one of the strongest data sets in the country, cutting edge technology, and the ability to see your insights turned into real products on a regular basis.",0,1,0
695,1931,we are a team who are about the right solution above everything else.,0,0,0
696,2818,they are rapidly expanding their data teams across all areas due to their huge growth.,0,0,0
697,2786,"know when to employ different machine learning techniques and when to build these into production models, to close the feedback loop between our games and the analytics system.",0,1,1
698,1105,our client is a small physical commodity broking company specialising in the international grain industry.,0,0,0
699,2169,"leads some strategic projects in collaboration with stakeholders
collaborates with other related teams on data science and big data projects


requirements

what we want from you 
ambiguity is able to deal with moderate levels of ambiguity by bringing clarity to the problem and communicating plans and working toward a solution with both technical and non-technical stakeholders.",0,0,0
700,2692,"we're bringing a new approach to the used car market; bringing it up to speed by building a modern, digital, retail process centered around our customers.",0,0,0
701,900,"you will identify high-quality opportunities for data-driven insight, taking the lead in improving the way data is collected, stored and used in the team.",0,0,1
702,1063,"as our data scientist, you will
design data models to inform the ‘insights’ provided to our customers
work directly with developers and designers to build the core data-analytics platform on which the app will be built
intelligently analyse and report on a range of marketing campaigns across a suite of online channels to drive the optimisation of marketing spend
research and develop ways of building ‘virality’ within our customer-base.",0,2,0
703,2826,experience using data mining & descriptive analytics to explore & profile new datasets.,0,0,1
704,101,"high proficiency in programming in python and other related scripting languages
experience with messaging and or data streaming technologies such as kafka, activemq, azure service bus, and azure event hubs.",0,0,0
705,412,"·proficient data analytics in python (pandas, numpy, scipy, scikit learn)
·well organized with meticulous attention to detail.",0,0,0
706,1324,"the role 

to empower effective data-driven decision-making through surfacing the most relevant insights from data; through reporting, analysis, and optimisation with a focus on establishing best-practice processes and partnering with teams to understand their needs and challenges.",0,1,0
707,2803,experimental design.,0,0,0
708,566,"have great knowledge of what makes a good process and being able to apply frameworks and methodologies for the right problem
1-2 years experience, especially coaching team members or interfacing with product managers/stakeholders
not essential but nice to haves
entrepreneurial
understands business value and what moves the needle
ambition to work on product or build a startup
business savvy
📈 benefits

this is your rare chance to contribute across the full business spectrum to become a founder in the future 

we provide all the excitement and freedom of an early stage startup but with the stability and resources of a large organisation.",0,0,0
709,874,"we will not be accepting requests to work with agencies.at fdm it’s ‘business as usual’, we are recruiting now and throughout the year.",0,0,0
710,424,you’ll engage with end users to understand their needs and identify which insights will be most relevant.,0,1,0
711,1896,do you have database management experience?,0,0,0
712,2930,we deliver winning media outcomes for brands the world over.,0,0,0
713,1078,"the role

the business data analyst role forms part of the dai team responsible for supporting axa ppp data deliveries and transformation.",0,0,0
714,1267,private medical insurance (bupa) – you will immediately be eligible to join bossa's healthcare scheme which is provided by bupa.,0,0,0
715,1357,help mentor msc and phd students in this unique team.,0,0,0
716,160,"you will be expected to be hands-on but with managerial responsibility, you will be decisive and lead the development team helping resolve complex problems.",0,0,0
