,index,0,bb,bt,tt
256,2668,"thanks to your conceptional working method, you generate conclusive examples and scenarios during this trial project and focus on the most relevant kpis to convince our customers of its performance and benefits.",1,1,0
257,275,"you should be an excellent communicator comfortable dealing with all levels and types of user and in return, my client can offer significant room to grow and expand your experience.",0,0,0
258,2448,"key responsibilities
develop modeling, simulation, and validation tools to support our ai production team.",0,0,2
259,1281,"if you want to be our north star and guide production teams to make the best decisions, check the role out below!",0,1,0
260,2204,"you will have previous experience of stochastic, dynamic, or robust optimisation problems.",0,0,0
261,1154,essential.,0,0,0
262,814,reporting to clients through either written or verbal presentations.,0,0,0
263,1920,"if you are looking for an opportunity to work on this exciting project, please apply to be considered.",0,0,0
264,266,you will become a key player in analysing and developing the best solution available with other members of staff.,0,0,0
265,170,we're now expanding globally to capture more of the 1bn night global camping market.,0,0,0
266,574,"office meals: catered lunches 2 days a week, unlimited breakfast, healthy snacks, freshly ground coffee and paul’s irish bar.",0,0,0
267,2202,"you will be working on industrial-scale optimisation problems involving combinatorial optimisation across many areas of the business, such as:
vehicle routing and warehouse management
pick-route optimisation in stores and depots
network optimisation
people and resource optimisation
spatial optimisation in stores and depots
price optimisation
main responsibilities
your main responsibilities will be:
to work on technical problems within the capacity planning and fulfilment domain by using prototypes in java  or python or other suitable languages
to work with the principal data scientist to help identify areas of impact across multiple business domains
to work collaboratively within the data science team to help solve broader data science problems
to be able to present clearly to the business about your technical area and the business ramifications of technical designs and results on a project
to work with the data science scrum master and the wider data science team to use/learn agile and kanban project management approaches to tackle projects
to identify new innovative projects yourself to work on in your 20% time
to keep yourself up to date with the latest technical innovations in optimisation and to learn new technical areas
to be prepared to give seminars to the data science team and externally on technical subjects that you are enthused about
 
the ideal candidate
you will be expected to be an expert in at least one aspect of or such as mathematical programming constraint programming and/ or designing and implementing meta-heuristics.",0,2,0
268,2504,data curation: integrating data from different sources including the first party mobile app data and some third-party public data.,0,0,2
269,102,"experience of hybrid and/or cloud distributed architectures that utilise hadoop / mapreduce / aws / tensorflow /azure
knowledge of data structures design and use
have experience implanting algorithms and data-structures
have a reasonable grasp of linear algebra, calculus and discrete mathematics(senior) climate risk scientist
location: london nw1
competitive salary, annual bonus, 35 days of paid holiday per year, including uk bank holidays
 
our client is a leading provider of climate and sustainability analytics for the financial sector, and has launched a new venture to continue the rapid growth of that business.",0,1,0
270,451,"perform data analysis, using sql to support reporting capabilities
create regular reporting on both product & project level kpis & dashboards using bi tools
ad-hoc data analysis & problem solving
required experience
strong sql experience working with large & complex data sets
excellent communication skills
analytical approach and inquisitive mindset
previous experience in game development environment
passion for games
desired experience
previous experience in data analytics or statistics
experience with power bi, tableau, looker or other bi tools
knowledge of programming languages (python, r etc) to create custom data visualisations where beneficial
please provide a cover letter to support your application.",0,1,0
271,75,understanding of both classical and deep machine learning approaches.,0,0,0
272,1108,in return you will receive full training and support from the senior management team.,0,0,0
273,2469,you have a passion for data science and want to use data to make a positive difference to the studio.,0,1,0
274,1164,understanding of the application of statistical methods to epidemiological studies.,0,2,0
275,1991,"this will be achieved by adherence to all relevant procedures, keeping appropriate records and, where appropriate, by the timely implementation of internal and external audit points, including issues raised by external regulators.",0,0,1
276,706,work with middle office staff and appropriate business functions to implement tactical solutions which complement the strategic vision and roadmap.,0,1,0
277,2192,"benefits
up to 5% employer pension contribution with aviva
private health insurance with vitality
full dental insurance
life insurance
long term disability insurance
25 days’ holiday
employee assistance programme
bonus scheme
season ticket loan
personal development & career plans
relocation support
study assistance program
moving house dayour vision here at tesco is to become every customer's favourite way to shop, whether they are at home, out shopping, on the move, anywhere in the world.",0,0,0
278,853,understand and work well in startup culture - be able and willing to take on all sorts of tasks and responsibilities.,0,0,0
279,1401,"data management, an understanding of data governance and how it relates to other organisational governance structures.",0,0,1
280,1891,"5-decisiveness

2-acts quickly and decisively when others might wait, study the situation and hope the problem will resolve itself.",0,0,0
281,2590,we are looking for an innovative individual with a natural inquisitiveness and great problem solving skills.,0,0,0
282,1634,"collaborate with consultants, customer success managers, and technical services to deliver successful customer journey optimisation programmes to clients.",2,0,0
283,1706,"we extract value from data in many different ways, and experience exploring and extracting insights from data is just as important as the ability to build complex models.",0,1,1
284,1721,"expect a global business, great benefits, groundbreaking campaigns and superb clients.",0,0,0
285,2002,we want everyone to be able to fulfil their potential which is why we provide a range of flexible working arrangements and family friendly policies.,0,0,0
286,73,"using dev boards, sdrs, python/c++)
to develop a technical relationship with the customer
to lead and mentor junior colleagues

your skills & experience
qualified with an engineering/physics/maths degree or phd.",0,0,0
287,427,"about you

to join us as a data scientist, the below is essential: 

- demonstrable experience in the development and application of data analysis and/or machine learning to large-scale datasets
- experience of writing well-documented, maintainable code 
- a phd in statistics, maths, physics, ecology, sociology or geography (or demonstrable equivalent research experience)
- knowledge and experience in data analysis: processing and analysis of spatial data and time series, statistics, probability theory and combinatorial analysis
- strong ability to reason under uncertainty: combine quantitative analytical thinking with contextual knowledge and use critical thinking to extract and interpret information from data
- a genuine interest in, and the willingness to further understand, the mission and operations of our organisation
- a genuine desire to see the outputs of your work improve the lives of vulnerable populations 
- excellent written and verbal communication skills 
- the ability to work well independently and as part of a team

highly desirable criteria: 

- at least two years’ experience of python data analysis libraries, such as pandas, numpy and bokeh/matplotlib, or matlab, r or equivalent
- experience with mobility or flow data, spatial data and spatial models, survey data (geo-located questionnaires), and data integration 
- previous experience in large-scale data mining or artificial intelligence 
- experience with a big data ecosystem - algorithms, tools and technologies
- experience in applying quantitative methods to support governments and humanitarian actors’ decision making
- experience with geographic information systems (gis)
- experience of working on real-world problems in resource poor settings (low and lower middle-income countries)
- a good understanding of low- and middle-income contexts 

other organisations may call this role mobile data scientist, mid-level data scientist, senior data scientist, lead data scientist, data analyst, insights analyst, or mobile data analyst, project design analyst.",0,1,0
288,1430,this check also applies to employees who resign or otherwise leave before being dismissed for fraud or dishonesty had their employment continued.,0,0,0
289,1673,"collaborate and learn from other data scientists, whilst also being engrained in your cross functional squad.",0,0,0
290,2220,"to do this, we have created a unique partnership with the nhs that delivers a return to our partner trusts and unlocks the value of clinical data for research while safeguarding patient privacy.",0,0,0
291,1600,"jagex are an equal opportunities employer and positively encourages applications from suitably qualified and eligible candidates regardless of sex, race, disability, age, sexual orientation, gender reassignment, marriage or civil partnership, pregnancy or maternity, religion or belief.junior data analyst

adroit data & insight are a specialist data agency, based in cirencester.",0,0,0
292,2175,coding proficiency using at least one programming language.,0,0,0
293,1697,"you will be a key member brought in to build a team who will focus on building data science products to support the wider business, everything from sales functions to internal investment processes.",0,1,0
294,2175,coding proficiency using at least one programming language.,0,0,0
295,1950,coordinate with different functional teams to implement models and monitor outcomes.,0,0,2
296,1343,"demonstrates proficiency in using r, python or other statistical programming packages
strong proficiency in predictive modelling —to include comprehension of quantitative genetics theory, modeling/identification strategies and limitations and pitfalls
experience in successful delivery of valuable analysis through application of domain knowledge; evidence of ability to strong business acumen
strong communication competencies to include presentations and delivery of complex quantitative analyses in a clear, concise and actionable manner to extended team and small groups of key stakeholders 

country: united kingdom
location: cambridge
reference code: 160582
functional area: biological r&dbiological r&dwhitehall resources are looking for a data scientist to join a global consultancy.",0,0,1
297,1123,"profile
knowledge of using electronic patient databases for input and analysis
configuring databases and creating activity and data quality reports
knowledge of delivering training to individuals/groups
advanced excel skills, including pivot tables and charts
proficient user of microsoft office applications
excellent attention to detail and able to scrutinize numerical and written data
problem solving, analytical and judgmental capabilities to resolve complex data and reporting issues where a number of alternative solutions are present
able to identify different ways to extract data and configure systems to support current and future business intelligence needs
developed data manipulation and interrogation skills
able to set own objectives, work autonomously, prioritise workloads and work under pressure to meet strict deadlines
job offer

£14 - 16 per hour
lead data scientist  
£85,000 - £95,000 + bonus
e-commerce 
london

are you interested in acting as the sme within data science and working on something fully greenfield?",0,0,1
298,1693,note: the purpose of this profile is to provide a general summary of essential responsibilities for the position and is not meant as an exhaustive list.,0,0,0
299,876,"these consist of remote working, virtual training, video interviewing, and access to webinars and virtual events.",0,0,0
300,265,"at the same time, as all areas of the business are growing in multiple directions, new products, reports and tools are needed.",0,0,0
301,83,"in some instances, developed vetting (dv) is required.",0,0,0
302,1188,you will work closely with our cto to help push the boundaries of what the echobox artificial intelligence is capable of achieving with this data.,0,0,0
303,2779,"we really don't have much in the way of red tape, so expect to start making a positive impact on our games, right from the get-go.",0,0,0
304,2427,"however, as women are currently under-represented in our workforce, we would particularly welcome applications from women.",0,0,0
305,590,"here's a taste of what you will be doing:

run pricing and support decisions around tariff options.",0,1,0
306,621,successful candidates are placed on a fast track career progression and have the opportunity to work and learn from some of the most famous brands in the world.,0,0,0
307,280,"heavily vc backed - $20m
huge client list
in 2 years they have grown revenue from $6m to $120m
global offices in various continents
first class training and on-boarding programme
a humble, dedicated, excellent and highly intelligent team
 
the role:
they are now looking for their first uk data scientist to join their excellent team.",0,0,0
308,671,you will also be exposed to senior management across the group and make an outsized impact early in your career.,0,0,0
309,883,as a business intelligence data analyst you will use your investigative and problem solving skills to analyse data and uncover trends that deliver actionable insights for the business.,0,2,0
310,2017,"*this role can be based out of either one of our oxford or cambridge offices, with flexible hours and partial home working possible.",0,0,0
311,2735,"requirements
advanced sql (common table extensions, window functions etc.)",0,0,0
312,572,health and wellness: comprehensive extended health care coverage from vitality and spill counselling.,0,0,0
313,371,learn more about cgi at www.cgi.com.,0,0,0
314,1347,"4-5 days client site with possible european travel thereafter

excellent salary and benfits on offer ££££

do you have?",0,0,0
315,1456,they will be confident in working with a variety of data sources as well as effectively communicating to technical and non-technical audiences.,0,0,0
316,2709,"in a more professional sense they want someone who has strong data science experience, whether that's just out of university or 25+ years experience, as long as you meet the requirements above, they are interested in hearing from you.",0,0,0
317,430,the services advertised by webrecruit are those of an employment agency.,0,0,0
318,2511,"working on challenges related to liquidity, acquisition and product conversion.",0,0,0
319,770,experience building statistical models.,0,0,0
320,1945,"mine and analyze data from company databases to drive optimization and improvement of product development, marketing techniques and business strategies.",0,2,0
321,446,"working across products both in active development & in live support cycles, data analysis will cover a broad range of activities such as supporting the design team with level/vehicle balancing insights to working closely with business stakeholders to better understand player behaviour.",0,2,0
322,1169,experience of bioinformatics and genetics-related toolsets.,0,0,0
323,2012,experience developing production software is a plus.,0,0,0
324,922,"we carefully consider agile ways of working, both formal and informal, that allow for the best impact for our people and our clients.",0,0,0
325,2584,"good scripting and programming skills
data-oriented through and through
master’s degree or above in related disciplines


benefits
employee ownership options
training & development is actively encouraged
flexible working hours
remote working possibilities
diverse project portfolio
funding towards extra curricular activities ie.",0,0,0
326,2902,"using fashion-specific ai, expert knowledge and proprietary data, they are looking to deliver a prediction platform that can offer clients the ability to predict customer behaviours and fashion trends to optimise and personalise shopping journeys.",0,2,0
327,1963,wellness.,0,0,0
328,1833,"we want to facilitate everyone in bringing their best selves to our interviews, so if there are any adjustments we can make for our process to be more inclusive, please let us know.data scientist 

data idols are working with a well know online brand to find an experienced data scientist.",0,0,0
329,1634,"collaborate with consultants, customer success managers, and technical services to deliver successful customer journey optimisation programmes to clients.",0,1,0
330,1551,"about sse

we all have different skills here at sse and that's what makes us stand out.",0,0,0
331,127,"you'll have demonstrable experience in data architecture, analysis and modelling, as well as data warehousing.",0,0,0
332,2946,"discover more about groupm at www.groupm.com follow@groupmworldwide on twitter follow groupm on linkedin https://www.linkedin.com/company/groupm

we are an equal opportunity employer it is the policy of groupm and its affiliates to provide equal employment opportunities to all employees and applicants for employment without regard to race, color, religion, gender, sexual orientation, national origin, age, disability, marital status, or status as a covered veteran in accordance with applicable federal, state and local laws
who are we?",0,0,0
333,1740,"utilising problem-solving skills and judgment necessary to analyze, troubleshoot, and problem-solve issues and provide proposed solutions
training in the use of the review platforms will be delivered either on-site or remotely using webex technology.the data analyst will work with project managers to ensure that the client maximises their use of the review platforms to achieve the highest levels of service delivery and client satisfaction.",1,1,0
334,295,"whilst the role will eventually be based at the impressive willerby offices in east yorkshire, the current climate means that the role will initially be fully home based.",0,0,0
335,2198,joining us means playing a part in defining; building and launching an ambitious roadmap of digital products that could affect the lives of millions of people over the years to come.,1,0,0
336,1543,"intellectually curious, you'll also demonstrate strong interpersonal and communication skills with the ability to present complex ideas to technical and non-technical audiences.",0,0,0
337,251,"we believe the best information about a residential development comes from the people living there not just on the property itself and its locality, but also on the developer and the building’s management.",0,0,0
338,1307,"aptean uses its core values of drive for results, win together, foster innovation, and be courageous to guide its employee community to serve every customer in every geography and market.",0,0,0
339,1750,"enable the business with data solutions
gather requirements, scope projects and build a comprehensive and realistic data roadmap as part of the business intelligence team and senior stakeholders.",0,1,0
340,234,our jobs are open to all.,0,0,0
341,2316,"our company provides equal employment opportunities (eeo) to all employees and applicants for employment without regard to race, color, religion, sex, national origin, age, disability or genetics.liberty it employs over 500 people who develop a wide range of specialist and enterprise scale applications and provide technical support across the global enterprise for our parent company, liberty mutual.",0,0,0
342,1964,"gym discounts, health insurance, unlimited coffee, beer, and cereal, enhanced maternity and paternity packages, unlimited holiday and flexible working options, pension.",0,0,0
343,1197,"to get a better insight into the kind of work we do, check out our open-source project on github, our data showcases and our youtube content on microservices.",0,0,0
344,825,"25 days’ holiday, with optional 5 days unpaid leave per year
free fruit, biscuits, tea and coffee
annual lifestyle allowance of £300 to put towards an activity of your choice
cycle to work and gym flex scheme
focus on training and career progression
competitive salary

we are proud to be an equal opportunities employer.",0,0,0
345,1156,proficiency in using relational databases and writing sql queries.,0,0,0
346,93,"www.datais.energy 
position purpose:
we rely on data scientists to run a wide range of machine learning methods monitoring for efficacy and degradation, continually improving our forecasting and relationship discovery.",0,0,2
347,10,·educate others on statistical analysis and scientific investigation.,0,0,1
348,1729,"maths, economics, science, computer science;
previous experience of supporting other analysts in building efficiencies and automated workflows;
prior experience of conducting landscape analysis of new areas (e.g.",0,0,1
349,1878,"the digital team is one of newton’s specialist capabilities, along with change management; these teams work seamlessly with the core consulting body to enable delivery of exceptional results for our clients.",0,0,0
350,1301,"aptean is on a mission to end those workarounds – with industry-specific solutions instead of generic software, expert support instead of making you go it alone, and a steady influx of new ideas instead of the status quo.",0,0,0
351,1488,"provide support and first-line advice to data asset owners and administrators for all hospice systems, to ensure information governance (ig) and data protection procedures are in place, documented and audited and are able to support current and future business intelligence needs.",0,1,0
352,1335,"we’re looking for smart people to help us understand it better, pull disparate data sources together and look for opportunities to get better in everything we do.",0,0,0
353,475,"in this role you’ll to join the clients’ well-established, specialist team of data science experts, whose sole focus is to create innovative models to solve challenges that the industry are either facing now, or will face in the future.",0,2,0
354,2201,you will work closely with the business and engineering teams to deliver effective optimisation solutions to diverse business problems.,1,1,0
355,2380,"strong analytic and problem solving skills, especially in the area of predictive modelling.",0,0,0
356,80,rf or cyber background is desirable but training can be provided.,0,0,0
357,384,"your new role
you will play a key role in ensuring that the client understands the data patterns and that the processes being developed for the underlying indices (geography, classification, address, demographic and business) are done so using innovative and smart ways.",0,1,0
358,2254,"no agencies!shape and determine the deisgn of nlp platform for the bank

extension practical experience building and implemtning machine learing models (in nlp space)

practical engineering experience

lead a small team of data science nlp specialistspwc

a career within forensics technology services, will provide you with the opportunity to help our clients protect their business in today’s evolving landscape by applying advanced and strategic approaches to information management.",0,2,0
359,408,·5+ years’ experience in related field is preferable.,0,0,0
360,15,·educate others on statistical analysis and scientific investigation.,0,0,0
361,2195,we’re driving innovation and transforming our technology to become the world’s leading retailer.,0,0,0
362,2121,we call this the absolute work title freedom.,0,0,0
363,126,our data modeller will need a strong understanding of the utility energy industry to be able to place the drax data warehouse model into strategic business context and engage with business stakeholders.,0,2,0
364,1773,the team supports development of key policies and liaises with the voluntary sector to deliver the council’s strategic aims.,1,1,0
365,942,"this can mean that you and your ""immediate family members"" are not permitted to hold certain financial interests (shares, funds, bonds etc.)",0,0,0
366,1806,"we are committed to flexible working, therefore if you would like to consider this as a part-time opportunity, please email recruitment@lloyds.com

should you feel that you require reasonable adjustments during your application process we request that you please follow this link to create a cleartalents user profile

at lloyd's we believe that innovation comes from having an inclusive culture of equality and diversity.",0,0,0
367,2902,"using fashion-specific ai, expert knowledge and proprietary data, they are looking to deliver a prediction platform that can offer clients the ability to predict customer behaviours and fashion trends to optimise and personalise shopping journeys.",0,2,0
368,2346,"we’re doing something new within bt, with the significant digital, data and brand strengths of bt to draw on.",0,0,0
369,2394,the opportunity to make a difference by leveraging your unique strengths.,0,0,0
