,index,0,bb,bt,tt
0,1784,"a competitive salary alongside a range of benefits including
generous holiday entitlement - 24 days holiday each year plus bank holidays - rising to 32 days after 10 years' service, with the option to buy additional leave
a wide range of flexible working opportunities
modern working environment at the civic offices in the heart of reading
(lgps)
on-site day nursery (kennet day nursery) rated outstanding by ofsted, and a salary sacrifice scheme to help lower the cost of your nursery fees
season ticket loan - to help with the cost of your rail/ bus journey, to & from work
lease car salary sacrifice scheme allowing you to lease a brand new, greener car for three years.",0,0,0
1,891,"after this time, you may continue your career with fdm or join the client as a permanent member of their team.",0,0,0
2,97,"able to work as part of a team and communicate effectively with all levels and disciplines
have a graduate qualification in an analytical or science-based discipline e.g.",0,0,0
3,847,"if you have a mischievous spark of fun, that’s even better.",0,0,0
4,1981,"operational effectiveness & control
hsbcs adherence to the requirements of the deferred prosecution agreement (dpa)
create and deliver analytical solutions that are fully documented and explained that meet the business aims/requirements.",0,2,0
5,406,·collaborate with other members ai & automation and clients.,0,1,0
6,2687,"we do not discriminate based on race, ethnicity, colour, ancestry, national origin, religion, sex, sexual orientation, gender identity, age, disability, veteran status, genetic information, marital status or any other legally protected status.",0,0,0
7,1815,"no applicant shall receive less favourable treatment on the grounds of sex, marital status, civil partnership status, trans-gender status, pregnancy, maternity, race, nationality, ethnic origin, religion, belief, sexual orientation, disability, age.",0,0,0
8,1064,we are growing an organic customer base where users feel inspired to share with their friends and family.,0,0,0
9,113,"from extracting reports from excel and simulating algorithms through data analytics tools, they assist businesses in gaining a wider insight into their current situation, drawing conclusions and determining informed decisions and strategy to improve their business.",0,2,0
10,1433,any move to the department for international trade will mean you will no longer be able to carry on claiming childcare vouchers.,0,0,0
11,631,"you will be part of the multidisciplinary diagnostic science team comprising of computational biologists, machine learning experts, software engineers, postdoctoral researchers, disease area specialists and clinician experts contributing novel ideas and developing prototypes of algorithms and analytical approaches impacting current and future patient journeys.",0,1,1
12,1045,we offer a fantastic working environment in the heart of shoreditch and are spoilt for choice for venues to host our regular social events.,0,0,0
13,28,"proactively develop new analyses, experiments and data-driven tools to better understand our players’ behaviour and the performance of our games
provide insights to support decision making for the portfolio of games in the studio
translate business needs to technical requirements and ab-tests, and work with development teams to ensure correct implementation, taking care to correctly track the right information to allow easy, precise analysis of the impact
work closely with other data scientists across the business to leverage insights from one game across multiple games
carefully check, debug, and problem solve issues to ensure you deliver accurate and clear analysis, reports and tools, even when confronted by subtle data complications
skills to create thrills

role

specific factors that are helpful to excel in this role include

there is plenty of scope at king for you to learn from your colleagues in the areas where you have less experience, and to share your own skills where you are stronger.",0,1,0
14,2643,masters or phd desirable.,0,0,0
15,2703,"you will be solving some of the biggest challenges in a variety of sectors, one month it could be with a large bank, the next a biotech startup looking to change how we interact with the people around us.",1,1,0
16,1149,"the post-holder will work closely with a multi-disciplinary team of programmers, statisticians, epidemiologists, research and administrative staff and will report to uk biobank’s senior data analyst based in cheadle.",0,0,0
17,1838,please submit your cv for consideration.,0,0,0
18,98,"engineering/maths/computer science or equivalent

your technical skills and experience:

ideally you would be proficient in a good selection of the following:
algorithmic complexity theory
numerical stability
parallelism & concurrency
testability
object oriented design
interface driven design
low latency architectures
numerical, statistical and machine learning techniques.",0,0,0
19,418,we are striving to create a world in which decisions that can improve the lives of vulnerable people are based on the most appropriate evidence.,0,0,0
20,1077,"if that sounds like you, we’d love you to apply today!",0,0,0
21,2658,"in particular, we need data scientists with a software development slant, perhaps from a computer science background academically.",0,0,0
22,2521,what will you be paid?,0,0,0
23,261,"• identify, analyse, and interpret trends or patterns in complex data sets
• locate and define new process improvement opportunities

candidate attributes:
• excellent excel capabilities and presentational skills
• an analytical degree and a demonstrable passion for data led thinking
• a strong analytical toolkit that enables you to interrogate data quickly and independently - excellent sql, excel, and data visualisation skills
• self-motivated individual
• adept at queries, report writing and presenting findings
• genuine interest in residential property.",0,0,2
24,651,detailed knowledge of core computer science concepts (e.g.,0,0,0
25,2546,"about us
we are one of the world’s largest research companies and currently the only one primarily managed by researchers.",0,0,0
26,1493,recruitment south east aim to respond to all applications personally.,0,0,0
27,399,"responsibilities
·review academic and industry literature for applicable knowledge.",0,0,0
28,734,"when working on specific projects allocated to the incumbent, to work within planned processes that have been agreed with management of the data team.",1,0,0
29,50,"you can find more information on our culture, values and benefits, including relocation packages at jobs.king.com.",0,0,0
30,242,"responsibilities

join our data science initiative to allow us to use our comprehensive data sources to apply algorithmic learning across the organisation

extend our existing data models to incorporate new attributes

report on any improvements/regressions in the accuracy of our data models

help to solve key business problems (e.g.",0,2,0
31,254,"your main role would be to drive actionable insights from data across the business - analysing data from our chatbots, review input forms, user sessions, ga dashboards and bring out patterns and wrap up findings in engaging presentations.",0,1,1
32,859,"with a rapidly growing user-base in the millions, the ideal candidate for this role is an ambitious strategic thinker who loves to test and thinks about the bigger picture.",0,0,0
33,339,"amazing prospects, a recruitment agency at the heart of the technology community in cambridge.job description

job description data scientist

position description
now, more than ever we are ensuring the continuity of critical services that matter and we are still recruiting during these challenging times.",0,0,0
34,2260,"investigative analytics

in an increasingly digitised world, instances of fraud and electronic crime are becoming more and more common.",0,1,0
35,601,"a strong business analytics background - experience working with and manipulating numerical, textual and time-series data.",0,0,0
36,1622,if you feel you have the right experience and skill set for the position of data analyst / scientist; then please don’t hesitate to apply for the role.,0,0,0
37,262,"• over 5 years relevant work experience

benefits:
• work alongside a small friendly and entrepreneurial team
• fixed salary of between £40k - £50k dependent upon experience
• allowance of 25 days holidays
• when applicable - west end office close to hyde park & marble arch with opportunity for remote working
• opportunity to be included in future emi option schememy client a niche investment company is now looking for a data analyst to join the ever-growing friendly team.",0,0,0
38,400,·educate others on statistical analysis and scientific investigation.,0,0,1
39,3024,"experience of productionising ml models: kubernetes, docker, airflow etc.",0,0,2
40,1934,an important component of this effort is building a large-scale knowledge base where multimodal information from various structured and unstructured sources can be jointly explored and leveraged.,0,0,2
41,1575,"as a data scientist your background will likely include:

·      a master’s degree in data science, statistics, machine learning or similar fields.",0,0,0
42,2587,"we do not discriminate on the basis of race, religion, colour, national origin, gender, sexual orientation, age, marital status, veteran status, or disability status.job purpose

the explosion of digital technology is disrupting many industries and we cannot assume that bat is immune to this trend.",0,0,0
43,2998,we celebrate diversity and are committed to creating an inclusive environment for all employees.,0,0,0
44,388,"what you need to do now

if you're interested in this role, click 'apply now' to forward an up-to-date copy of your cv, or call us now.",0,0,0
45,2590,we are looking for an innovative individual with a natural inquisitiveness and great problem solving skills.,0,0,0
46,230,"r, an advantage
 
closing date: monday 25th may 2020
 
we love different perspectives and celebrate individuality.",0,0,0
47,1435,"reasonable adjustment
if a person with disabilities is put at a substantial disadvantage compared to a non-disabled person, we have a duty to make reasonable changes to our processes.",0,0,0
48,369,all of our professionals benefit from the value we collectively create.,0,0,0
49,949,"deloitte offers global integrated professional services that include audit & assurance, consulting, financial advisory, legal, risk advisory and tax consulting.",0,0,0
50,711,provide /coordinate additional administrative support as business development and maturity requires.,0,0,0
51,768,"qualifications
master’s or bachelor’s degree in data analytics, data science, computer science, statistics, or another closely related field.",0,0,0
52,1907,develop and manage relational databases.,0,0,0
53,2852,"we shine a light on human health outside of the hospital, delivering unprecedented insight's to healthcare professionals and surfacing those who are at high risk of illness before they deteriorate.",1,1,0
54,2865,"– demonstrable knowledge of a range of statistical techniques eg, bayesian statistics, probabilistic programming and graphical models
– strong knowledge of a variety of machine learning methods
– strong coding skills, proficient in r or python
– previous experience working with complex biological or ‘omic’s datasets, eg.",0,0,1
55,2530,please don't hesitate to get in touch with us for a confidential chat about how we can secure you your perfect big data job.are you looking to develop your career in one of the world’s largest research organisations?,0,0,0
56,977,"the data science team – the head of data science will have 4 lead data
scientists reporting to them with 4/5 people reporting to each of them.",0,0,0
57,36,that’s why we call ourselves developers of magic and knights of creativity!,0,0,0
58,2704,here you will never be stagnant or bored!,0,0,0
59,1647,you have a self starter mentality.,0,0,0
60,116,learn to translate numbers into english and use it to help some of the world's most famous companies make better business decisions.,0,2,0
61,1799,"three centuries later, the lloyd's market continues that proud tradition, sharing risk in order to protect, build resilience and inspire courage everywhere.",0,0,0
62,1674,responsibility of data quality for all key data sets.,0,0,0
63,1252,"as well as keeping a smile on your face with weekly massages, a games room, coffee shop, weekly food samples and amazing food hall to satisfy your daily breakfast and lunchtime taste buds.",0,0,0
64,2162,works with unstructured/semi structured data to extract useful analytic measures from the data flows.,0,0,2
65,2189,we understand that our employees are the key to our success and so ensure we pay above the industry standard and offer a comprehensive benefits package.,0,0,0
66,78,"coding experience including a combination (not all) of matlab, python, c/c++.",0,0,0
67,2730,the ideal candidate will be happy working alone but will still be a team player who can confidently and proactively communicate across the organisation.,0,0,0
68,1094,every large company today talks about supporting diversity and inclusion.,0,0,0
69,2208,you should be able to demonstrate a good knowledge of state-of-the art approaches and algorithms in combinatorial optimisation.,0,0,0
70,1662,on a day to day basis as the junior data analyst you will provide support to the users of the management information systems and applications.,0,1,0
71,1891,"5-decisiveness

2-acts quickly and decisively when others might wait, study the situation and hope the problem will resolve itself.",0,0,0
72,633,"development, deployment and support of precision medicine data analysis software and bioinformatic workflows and pipelines.",0,0,1
73,1751,"be an authority in the analytics field, by designing, developing and implementing best in class business intelligence reporting and analytics solutions.",0,1,0
74,1254,"our values: we’re in it together, we are proud of what we do, we can be even bettewelcome to bossa studios!",0,0,0
75,1326,"choice of wellbeing benefits which include private medical insurance and/or a gym membership
a membership with perkbox which gives employees access to plentiful discounts such as half-price cinema tickets at major cinemas including odeon and vue, free mobile insurance and many more
25 days holiday plus bank holidays
friday drinks
team lunches
team socials every month
free touchnote credits to use our product!",0,0,0
76,707,the project management of the solution design and implementation.,0,0,0
77,2478,strong knowledge of statistical techniques.,0,0,0
78,2571,we are looking for a data scientist that will help us discover the information hidden in vast amounts of data and help make smarter decisions to deliver even better products.,0,2,0
79,2456,"we really don't have much in the way of red tape, so expect to start making a positive impact on our games, right from the get-go.",0,0,0
80,175,"we’re based at the light box off the chiswick high road (nearest tube/train gunnersbury, kew bridge) and are a lively friendly team with bags of experience.",0,0,0
81,2272,"consulting with clients on business issues, often explaining complex technical concepts to non-technical people.",0,0,0
82,860,"embedded within the success team, the data analyst will work closely with onboarding, education, and engagement to uncover critical insights and develop hypotheses.",0,1,1
83,2023,"we’re now at an inflection point, with substantial growth in our commercial operations and operational infrastructure over the coming year.",0,0,0
84,296,"job requirements

about you

ideally, you'll haveexperience of working as an analystin digital marketing and/or retail environments with strategic focus being on delivery and results.together with:
experience and ability to use tableau, understand data structures and be able to train and support others to use tableau essential
demonstrable knowledge of relevant technologies: ga, adobe, google tag manager, microsoft excel, dashboarding solutions (data studio, microsoft bi, tableau, or similar), google sheets
working knowledge of javascript, html/xml/css, sql, python, r
ideally a degree or equivalentin a relevant subject area (e.g.",0,2,0
85,293,"analytics and reporting will naturally make up the majority of the role (circa 80%), with the other(20%) being focused on product knowledge, training and best practice.",0,0,1
86,22,"·proficient data analytics in python (pandas, numpy, scipy, scikit learn)
·well organized with meticulous attention to detail.",0,0,0
87,2319,"senior data scientist
as a senior data scientist you will work as a lead in a collaborative to rapidly and effectively deliver great solutions that adds real value to our customers.",0,1,0
88,2401,the long-term aim is for this person to grow out a data science team underneath them.,0,0,0
89,1396,data visualisation expertise and know how to visualise data to tell compelling and actionable stories relevant for business goals.,0,2,0
90,1178,it would also be a great option for a more junior candidate with relevant experience.,0,0,0
91,1012,"we work closely and collaborate with world-leading academics and industry practitioners in information retrieval (ir), natural language processing (nlp) and machine learning (ml).",0,0,0
92,2961,"more specifically to
proactively involved in maximising the potential for advanced analytics in delivering actionable insight, business uplift and revenue enhancement.",0,2,0
93,1230,the data analyst works closely with the population health analytics team and uses cutting edge azure technology to create dynamic analytics for use by health and care professionals.,0,2,0
94,1769,"the more diverse our workforce, the better able we are to respond to and reflect our audiences in all their diversity.",0,0,0
95,2300,"alongside this, you’ll also be a key focal point for external stakeholders – so prior experience in a customer facing capacity is also highly beneficial.",0,0,0
96,2906,an important aspect is designing new algorithms that can be rolled out in their offering.,0,0,0
97,1668,"this is an exceptional opportunity to secure commercial data analysis experience with the potential of a permanent role in the future.relocation opportunity to barcelona (remote start due to covid-19)
 
important: please note, this will be an onsite role in barcelona, and remote only is not an option.",0,0,0
98,2574,they require candidates to have u.k. citizenship or dual citizenship or have been a u.k. resident for more than 5 years.,0,0,0
99,319,"you'll fit in well if you...

&#128587;&#127995;‍♀️ are trustworthy, honest and operate with a high degree of integrity;
&#129406; are curious about new technologies and pragmatic about getting things done;
&#128105;&#127996;‍⚕️ are meticulous, exacting, precise and care about delivering to a high standard;
&#129299; have experience of using a bi tools and knowledge of a language such as sql, r, matlab, python, or julia;
&#128170;&#127998; are bright, outgoing, intelligent and a great communicator with a track record of success in whatever it is you do; and
&#128736; have excellent analysis skills with the ability to manipulate and interpret data, make recommendations and see them through to implementation.",0,0,2
100,1470,"role - data analyst
rate - £200 (negotiable - inside ir35)
location - london
duration - 3 months+

the role is based within the social care team and you will be contributing to the performance and data team by giving data and analytics across the whole council.",0,1,1
101,2910,"at least one years’ experience in developing machine learning or statistical models
strong sql skills and at least one of python, r, java, c, ruby

job owner: d.prosser

tagged as: aws, python, r, sqlprincipal data scientist – natural language processing (nlp) – london - circa £100k

are you passionate about creating unique intelligence from data?",0,0,0
102,139,"job main accountabilities:
as a telematics data scientist you will work alongside industry experts to further develop the octo telematics products and services.",0,2,0
103,786,you will be working on a large-scale telecommunications project and this role will be outside of ir35.,0,0,0
104,39,"we craft games for everyone, no matter where they are or who they are, and we employ all kinds of people from all types of backgrounds to bring them to life.",0,0,0
105,1591,"famed for its flagship mmos runescape and old school runescape, jagex has welcomed more than 260million player accounts to its world and created a $1bn lifetime franchise revenue.",0,0,0
106,2711,apply below and let's have a further conversation about the best opportunity you will hear about all year.octavia zydel are currently supporting a rapidly growing gaming business with the headcount acquisition of a data scientist.,0,0,0
107,530,"please note - in light of coronavirus (covid-19), all the heycar team are working from home and we will be holding all interviews virtually for the foreseeable future.",0,0,0
108,66,"the person we seek

driven, adaptable, innovative, self-starter capable of quickly assimilating information from a range of sources.",0,0,0
109,3005,"in this way, we can check that we are complying with the equality act (2010).",0,0,0
110,132,"drax group has offices based in selby, london, northampton and ipswich.",0,0,0
111,2238,this is an exciting time to be joining us.,0,0,0
112,1322,"our easy to use app has helped people nurture their most meaningful relationships over 15 million times and was awarded the good web guide’s app of the year 2018.

we are a team of passionate and creative individuals trying to make a difference.",0,0,0
113,1262,"responsibilities
manipulating and analyzing large, complex data sets representing the behavior of players and turning them into actionable insights to address strategic and operational business questions
provide actionable recommendations and conclusions from game data to shape game features and future product roadmaps
work closely with internal departments to drive insights that will help produce better games and drive towards retention and monetization improvements.",0,2,0
114,2454,"you will sit at the forefront of our analytics team, working in collaboration with our games teams, to bring positive changes to our games through data.",0,2,0
115,1721,"expect a global business, great benefits, groundbreaking campaigns and superb clients.",0,0,0
116,1851,"in return, we recognise and value our people.",0,0,0
117,339,"amazing prospects, a recruitment agency at the heart of the technology community in cambridge.job description

job description data scientist

position description
now, more than ever we are ensuring the continuity of critical services that matter and we are still recruiting during these challenging times.",0,0,0
118,2268,"so, if you are naturally inquisitive, have an analytical mind and enjoy solving problems in a rigorous and methodological manner, we’d be interested in talking to you.",0,0,0
119,53,our employees are unified in a shared dedication to our customers’ mission and quest for professional growth.,0,0,0
120,2445,"our primary focus is improving contact center interactions for sales, service, retention, collections, and customer satisfaction in fields ranging from telecommunications to healthcare to banking to hospitality.",1,0,0
121,685,"if you have any queries about this position, please feel free to drop her an e-mail.",0,0,0
122,1834,they are rapidly expanding their data teams across all areas due to their huge growth.,0,0,0
123,1571,big cloud have partnered with an international financial services business that is creating unique statistical and machine learning products.,0,0,0
124,2156,"research & development, research & development > biometricsthe data scientists are responsible for applying a wide variety of statistical and analytical techniques to business problems to glean valuable insights in support of key strategic business initiatives.",0,2,0
125,869,"if you are not located in vancouver, but interested in relocating for the role let us know!",0,0,0
126,481,"experience in handling data in sql or spark (mandatory)
strong technical architecture design and build skills
experienced in building end to end solutions on premise or on cloud
strong knowledge of atleast one of the cloud families from among - azure, google or aws
ability to scale up algorithms to production / big data scale
parkside recruitment ltd is acting as an employment agency in relation to this vacancy.",0,0,1
127,1880,"together, these specialist capabilities form a critical part of newton’s proposition.",0,0,0
128,55,"fundamental to our culture is an unwavering focus on values, dedication to our communities, and commitment to excellence in everything we do.",0,0,0
129,2935,"this reaches from research, hypotheses testing, data experiments, and predictive and prescriptive analysis, over development of modeling algorithms and prototypes, to data integration and etl design.",0,0,1
130,1493,recruitment south east aim to respond to all applications personally.,0,0,0
